{"packet_version": 1, "task_revision": "71353451b6516770882683e1ddc602b87cedbf2c1190e880d28967d29445f4cc", "task_digest": "2523cf3db622f401a747622086623c375934225ee97e3e3d564402db50e93787", "acceptance_contract_digest": "b94dd3b4fcbe888eb8b76a4a1a00752b429ea498164a43f0b5eacda975e46d12", "acceptance_source": "external", "input_snapshot_digest": "80dcb78120b386c46935344d345a92c4e83d51ed51c3ebbbc608ad2fcce63c51", "outcome": "solution", "readiness": "verified-ready", "premise_ids": ["prem-001"], "candidate_ids": ["cand-001"], "verified_findings": [{"premise_id": "prem-001", "text": "verified fact", "source": "test", "confidence": 1.0}], "rejected_hypotheses": [], "remaining_uncertainties": [], "safe_next_action": "apply the bounded change, then run acceptance", "operator_question": null, "artefacts": [{"path": "REPORT.md", "sha256": "b62376eb41a4800399af1e200e96ff3ac6220c8adbd2b71cf0cb2688a40a5b0a", "size": 34}, {"path": "ledger.jsonl", "sha256": "e3566b3a06430868d71e9287dfd6c6c520a3da027aabea01951d407ee131dc2f", "size": 4}], "accounting": {"known_spend_usd": 0.2, "reserved_usd": 0.0, "accounting_complete": true}, "packet_digest": "24c2294d0dcd34f07a260b45ce0f85908b78835984bea676e73358b8b56e9078"}