{"packet_version": 1, "task_revision": "2372b85c48c94a211b7f43041089b629c4a5eb835cc47b38190a8923f88173e6", "task_digest": "2523cf3db622f401a747622086623c375934225ee97e3e3d564402db50e93787", "acceptance_contract_digest": "8dbd878f80f33bd0d807121bbd758afa75c408117a5978120e1d0a6c3f12e881", "acceptance_source": "external", "input_snapshot_digest": "9dba6d27e6d4391c11f4cde8cef0964471670f56a500f69f6b2e93f6950787c2", "outcome": "solution", "readiness": "verified-ready", "premise_ids": ["prem-001"], "candidate_ids": ["cand-001"], "verified_findings": [{"premise_id": "prem-001", "text": "verified fact", "source": "test", "confidence": 1.0}], "rejected_hypotheses": [], "remaining_uncertainties": [], "safe_next_action": "apply the bounded change, then run acceptance", "operator_question": null, "artefacts": [{"path": "REPORT.md", "sha256": "b62376eb41a4800399af1e200e96ff3ac6220c8adbd2b71cf0cb2688a40a5b0a", "size": 34}, {"path": "ledger.jsonl", "sha256": "e3566b3a06430868d71e9287dfd6c6c520a3da027aabea01951d407ee131dc2f", "size": 4}], "accounting": {"known_spend_usd": 0.2, "reserved_usd": 0.0, "accounting_complete": true}, "packet_digest": "96f878cf98699ed5e492bd75afbc9ffee745d316b3f17318bf54c4035679b780"}